title,task,cost,date,views,answers,status
Разработка брошюры,"Добрый день. Требуется исполнитель на следующие услуги:
Макет брошюр и листовки

Формат сдачи брошюры Индизайн
Потребуется разработать 3-варианта дизайна
С пос…",Договорная,1970-01-01,76,37,Для Бизнес-аккаунтов
SEO-специалист на удаленку,"Требуется SEO-специалист на аутсорс. Работа с проектами нашего агентства, которых довольно много. 
Задачи:	
- сбор и кластеризация семантического ядра	
- написан…",Договорная,1970-01-01,38,24,Для Бизнес-аккаунтов
SMM продвижение онлайн-сервиса бьюти-тематики,"Онлайн-сервис для девушек ищем SMM менеджера, с опытом ведения в бьюти-тематике. Вы хорошо разбираетесь в трендах услуг салонов красоты, знаете поведение целевой ау…",8 000 р.,1970-01-01,26,13,Для Бизнес-аккаунтов
Летний развлекательный клуб,"Есть помещение 20 на 60 . Планируется открыть летний клуб, целевая аудитория от 18 до 35. Необходим внутренний дизайн помещение , внешний дизайн , и по возможности …",10 000 р.,1970-01-01,44,16,Для Бизнес-аккаунтов
редактирование/создание картинки в графических редакторах,"редактирование картинок,изменение фона,цветов,добавление предметов,обработка картинок",200 р.,1970-01-01,59,31,Для Бизнес-аккаунтов
Нужен 3d модельер чехлов на телефоны,"Нужен 3d модельер на различные чехлы на iPhone, Samsung, Huawei и другие...",Договорная,1970-01-01,99,21,
Почистить 20 фото,"Нужно удалить людей на 20 картинках

пример в приложении

ВАШУ ЦЕНУ И СРОК ПИШИТЕ В ПРОЕКТЕ",1 000 р.,1970-01-01,55,14,Для Бизнес-аккаунтов
УФ печать на табличке А4,"Добрый день!

Ищем рекламную компанию в Москве или Московской обл.у кого имеется УФ печать, есть большой заказ. Все подробности по телефону или на почту valyaeva·…",Договорная,1970-01-01,15,2,Для Бизнес-аккаунтов
Сертификат об окончании курса обучения депиляции,Нужно создать крутой и стильный серьификат об окончании курса обучения депиляции,Договорная,1970-01-01,66,48,Для Бизнес-аккаунтов
Скрипт для автозаполнения и выполнение действий по сценарию API,"Скрипт для авто заполнения и выполнение действий по сценарию API
Нужно получить данные или подхватить их из файла, далее заполнить форму на сайте, вывести страницу…",3 800 р.,1970-01-01,16,5,Для Бизнес-аккаунтов
decovision,"Необходимо разработать дизайн мобильной версии для сайта decovision.ru
выполнить верстку и программинг.",Договорная,1970-01-01,32,10,Для Бизнес-аккаунтов
Дизайн лендинга,"Здравствуйте, необходим редизайн текущего сайта, с новыми экранами. 

Подробное тз 
https://docs.google.com/document/d/1u5_i6PaQTpUKLdByOpkNHabKcJh5QgpfYgFpsnQGS…",40 000 р.,1970-01-01,165,68,Для Бизнес-аккаунтов
Лифты для коттеджей из Италии,Добрый день! Интересует стоимость и сроки создания сайта-копии вот этого: www.domuslift.com,Договорная,1970-01-01,78,48,Для Бизнес-аккаунтов
Требуется программист JS/JQuery,Нужно реализовать перемещение/ресайз div блоков на html странице по определенным правилам (ТЗ скину),10 000 р.,1970-01-01,167,25,
Реклама и продвижение в интернете,"Нужно привлекать клиентов для оформления полисов страхования ОСАГО, КАСКО, Туристов, Здоровья, Домов, Квартир и тд.

Каким образом – жду предложений от исполнител…",Договорная,1970-01-01,36,13,Для Бизнес-аккаунтов
Провести анализ сайта и предложить варианты улучшения и цену,"Проанализировать сайт bukvi-viveski.ru
Посмотреть доп. страницы и карточку товара.

По итогу предложить ваше решение по улучшению сайта и оптимизации его работы.…",Договорная,1970-01-01,32,22,Для Бизнес-аккаунтов
Создать Логотип и айдентику,"Необходим логотип компании НАДОСЪЕЗДИТЬ.РФ 
Компания занимается организацией экскурсионных школьных турпоездок по РФ
ЦА - учителя, родители",Договорная,1970-01-01,117,96,Для Бизнес-аккаунтов
Ведение инстаграм аккаунта,"Требуется администратор инстаграм! 

По всем вопросам, пожалуйста, пишите на прямую в инстаграм, логин: nastya_biznes_online

Или Ватс Апп: 89605311256
Но огро…",10 000 р.,1970-01-01,39,10,Для Бизнес-аккаунтов
Создание логотипа,Сделать логотип на основе уже почти готового. Компания занимается изготовлением лестниц на металлическом каркасе и столов в стиле  лофт.,300 р.,1970-01-01,118,79,Для Бизнес-аккаунтов
Статьи по Обязательной Маркировке,"Ищу копирайтера для написания статей, пример:

Маркировка обуви: https://www.kkm.ru/markirovka/obuv/ 
Маркировка шин: https://www.kkm.ru/markirovka/shina/
Марки…",Договорная,1970-01-01,27,13,Для Бизнес-аккаунтов
Помощь в настройки и регистрации в CPA сетях,"Настройка Продаж 1с облако через CPA сети 

https://sferait.info/catalog/1c/1S_Bukhgalteriya_predpriyatiya/95/?tab=description",Договорная,1970-01-01,12,3,Для Бизнес-аккаунтов
Мне нужна консультация по SEO,"Всем привет! 

Мне нужна консультация по SEO. Цена договорная. 

Есть два сайта. Один я буду развивать, но пока на него ссылается не очень много ссылок. И второ…",Договорная,1970-01-01,37,15,Для Бизнес-аккаунтов
Сделать адаптивку на santafox cms,"Всем привет. Ищу исполнителя ответственного, который сделает адаптивку на такой CMS.

Помимо адаптивки, надо в соотвествии с PSD и описанием которые я предоставлю…",4 500 р.,1970-01-01,16,5,Для Бизнес-аккаунтов
Отзывы Яндекс Маркет,"Запостить отзывы для магазина на Яндекс Маркет с живых, качественных аккаунтов.
Тексты отзывов пишу сам, отзывы писать не надо, просто постить. Предложите цену за …",Договорная,1970-01-01,16,1,Для Бизнес-аккаунтов
Рассылка сообщений в Instagram (Direct),"Необходимо вручную рассылать шаблонное сообщение людям в Instagram Direct
с предложением наших услуг

Изначально Вам нужно отправить 40-50 сообщений со своего ак…",5 000 р.,1970-01-01,497,40,
Нужны примеры дизайна интерьеров,"Для сервиса по дизайну и ремонту квартир с расчетом стоимости нужны примеры дизайна интерьеров в стилях: прованс, минимализм, скандинавия, лофт, неоклассика - из то…",Договорная,1970-01-01,87,9,
"Внесение правок, обновлений в существующий сайт на CMS WordPress","Провести аудит сайта на юзабилити, дать предложения по рационализации работы.
Внести правки, дополнить новыми страницами по аналогии с существующими.
Доработать с…",Договорная,1970-01-01,39,12,Для Бизнес-аккаунтов
обзвон базы клиентов,"Требуется менеджер на обзвон клиентской базы.

Обязанности

• Консультирование клиентов по услугам компании по телефону
• Осуществление исходящих холодных звон…",15 000 р.,1970-01-01,69,1,
Настройка и продвижение рекламной компании,нужно настроить РК в Яндексе и Гугле личный кабинет и ключи все есть. Продвижения продукта Кредит на исполнения госконтракта.,1 000 р.,1970-01-01,22,16,Для Бизнес-аккаунтов
"Одностраничник , сайт визитка для бизнеса , изготовление и монтаж лестниц.","Сделать сайт простой, но очень понятный и стильный. фото и т.д. я предоставлю . Могу даже пример сайта который можно тупо скопировать , но с моими тестами и данными…",Договорная,1970-01-01,144,112,Для Бизнес-аккаунтов
оптимизация сайта,"есть сайт http://new.elit-21vek.ru/
работает медленно нужно оптимизировать код и картинки",Договорная,1970-01-01,60,35,Для Бизнес-аккаунтов
Продвижения товаров на торговой площадке яндекс маркет. Настройка продвижения и оформление карточек товара,На яндекс маркете размещены объявления товаров но показ объявлений низкий. Объявления не  привязываются к карточкам товаров и за это го хромает рейтинг объявления. …,10 000 р.,1970-01-01,14,5,Для Бизнес-аккаунтов
Графический дизайнер,"Мы ищем графического дизайнера, который проникнется идеей нашего бренда и сможет сначала работать в рамках имеющейся стилистики (у нас есть готовый брендбук), а в д…",2 500 р.,1970-01-01,116,52,Для Бизнес-аккаунтов
Придумать название магазина.,"Здравствуйте. Создаю в Инстаграмм аккаунт магазина нижнего белья ручной работы. Хочу чтобы по Нику было понятно что я продаю, возможно чтобы было взаимодействие с м…",100 р.,1970-01-01,23,9,Для Бизнес-аккаунтов
Настройка интерфейса программы,"Имеется программа управления аттракционом. 
Состоит из 2-х частей:
1) Собственно сама программа управления.
2) Окно с таймером, которое выводится на экран, чтобы…",Договорная,1970-01-01,45,3,Безопасная Сделка
Сверстать одностраничный сайт,"Сверстать одностраничный сайт по PSD
на Wordpres
Картинка и ТЗ прилагаются.",3 000 р.,1970-01-01,145,52,Для Бизнес-аккаунтов
Я.директ и Google AdWords,"Интернет-магазин, расходные материалы и запчасти, 500-600 товарных позиций. РК – вся РФ. 

1) Проанализировать действующую РК в Я.Директ 
2) Проанализировать кам…",5 000 р.,1970-01-01,36,23,Для Бизнес-аккаунтов
Разработка HTML страницы для обложки сервиса по продаже кодов ОФД,Нужно подобрать подходящую по тематике картинку(ки) и текст для SEO продвижения странички и описания сути сервиса для новых посетителей. На страничку добавить метри…,500 р.,1970-01-01,28,8,Для Бизнес-аккаунтов
"Баннеры, реклама, оформление в Google Play и App Store. Ищу дизайнера для долгосрочного сотрудничества.","Привет!

Я Антон, руководитель проекта Дзен-мани. Это приложение для учета личных финансов.

Ищу дизайнера для долгосрочного сотрудничества: баннеры, рекламные …",Договорная,1970-01-01,70,47,Для Бизнес-аккаунтов
Разработка КР часть жилого дома,"Необходимо на основании АР части, разработать КР часть. Жилой дом, основные  материалы металлоконструкции, сендвич-панели, фундамент свайный. Площадь 304м2.",Договорная,1970-01-01,46,12,Безопасная Сделка
Разработка скрипта NodeJS + Socket + API (не сложного) - срочно!,"Разработка скрипта NodeJS + Socket + API (не сложного) - срочно!
Имеется ТЗ - обсужу голосом с исполнителем

Бюджет 3500 рублей, Оплата строго по готовности прод…",3 500 р.,1970-01-01,9,2,Для Бизнес-аккаунтов
Подготовить макет сертификата по заданным требования платформы GetCourse,"Необходимо подготовить макет сертификата об окончании курса solutionselling.ru на платформе getcourse.
По окончанию онлайн-курса платформа геткурс выписывает для у…",Договорная,1970-01-01,64,20,Безопасная Сделка
Создание b2b портала для оптовых сделок,"Наличие готовых конфигураций продуктов с возможностью быстрой установки и настройки.Быстрый запуск пилотного проекта.
На этап внедрения MVP  на портале требуется:…",40 000 р.,1970-01-01,24,10,Для Бизнес-аккаунтов
Дизайн и верстка 2 шаблонов email рассылки,"ВАЖНО: Вы должны проживать в Москве или МО, т.к. 1 раз придется приехать в наш офис м. Текстильщики в рабочее время с 9 до 17 и подписать договор оказания услуг (мы…",Договорная,1970-01-01,31,10,Для Бизнес-аккаунтов
Поправить рекламную компанию яндекс,Необходимо просмотреть существующую компанию РСЯ. Есть статистика по целям и кликам. Ценю данного проекта уменьшить стоимость заказа по Вашим рекомендациям с помощь…,Договорная,1970-01-01,33,17,Для Бизнес-аккаунтов
"Подготовка графических материалов для оформления онлайн-курса: обложки модулей, бейджи участникам","1. Для оформления дистанционного обучающего курса нам необходимы изображения для обложки модулей в кабинете геткурс. Я прилагаю скриншот, как выглядит галерея модул…",Договорная,1970-01-01,107,36,Безопасная Сделка
Программист Yii/PHP исправить админку на сайте,"Здравствуйте, 

Перестала работать админка самописного сайта на фрейворке Yii, и не отображаются некоторые кнопки в поле регистрации.
Нужно исправить.",2 000 р.,1970-01-01,13,8,Для Бизнес-аккаунтов
Убрать задний фон на фотографиях,"нужно быстро и оперативно убрать фоны на фотографиях , отредактировать фото по цвету",500 р.,1970-01-01,66,22,Для Бизнес-аккаунтов
Разработка дизайна мобильного приложения (12-15 экранов) - срочно!,"Разработка дизайна мобильного приложения (12-15 экранов) - срочно!
Имеется ТЗ - покажу исполнителю

Бюджет  3000 рублей Оплата строго по готовности продукта, БЕЗ…",3 000 р.,1970-01-01,54,19,Для Бизнес-аккаунтов
Разработка сайта,"Нужно разработать самый простой интернет магазин, с Белоруским  доменом, за минимальную плату, в кратчайшие сроки. все остальное обсудим лично",Договорная,1970-01-01,26,15,Для Бизнес-аккаунтов
ocStore 1.5.5.1.2 Копировать магазин на региональный поддомен,"Здравствуйте.
На домене ""китайское-печенье.рф"" имеется интернет-магазин на ocStore 1.5.5.1.2. На поддомене ""moskva.китайское-печенье.рф"" требуе…",Договорная,1970-01-01,25,6,Для Бизнес-аккаунтов
Создать сайт на WordPress (бюджет не ограничен),"Для мебельной фабрики необходимо создать сайт со структурой:

1. Главная страница
2. Каталог кухонь без корзины
3. Каталог столов и стульев без корзины
4. Ката…",150 000 р.,1970-01-01,133,85,Для Бизнес-аккаунтов
Внедрить систему оплаты ePay,"https://epay.kkb.kz/techdoc

Нужно подключить к сайту платежный шлюз ePay, ссылка на документацию",1 200 р.,1970-01-01,8,4,Для Бизнес-аккаунтов
Исправить ошибки в настройке динамического ремаркетинга гугл,"На Опенкарт 3 настроен динамический ремаркетинг гугл с помощью Аналитикса и Гугл Тег Менеджера.
Все вроде бы сделано, создан фид, проставлены коды на все страницы,…",Договорная,1970-01-01,14,5,Для Бизнес-аккаунтов
Разработать сайт по проведению онлайн семинаров,"Необходимо разработать фронтенд и бэкхенд для проведения онлайн семинаров. Проект в стадии MVP поэтому базовый набор страниц и функций будет минимальным: 
- 2 ленд…",Договорная,1970-01-01,56,23,
Рерайт материала (90% уникальности)+добавление информации по цифровой экономике,Необходимо провести качественный рерайт текста (14000-17000 знаков) и по договоренности расширить его.,500 р.,1970-01-01,22,6,Для Бизнес-аккаунтов
Выезд на обследование объекта г. Мончегорск,Выезд на объект для проведения предпроектного обследования,Договорная,1970-01-01,9,2,Для Бизнес-аккаунтов
Нужен копирайтер для написания продающих постов,"Ищу копирайтера для постов в инстаграм! инстаграм https://www.instagram.com/maneken_online/ посты дложны быть продающие, информативные и полезные",Договорная,1970-01-01,31,15,Для Бизнес-аккаунтов
Нужен копирайтер для написания продающих постов,"Ищу копирайтера для постов в инстаграм! инстаграм https://www.instagram.com/maneken_online/ посты дложны быть продающие, информативные и полезные",Договорная,1970-01-01,31,15,Для Бизнес-аккаунтов
Кто с эксель в ладах? Нужно легкое задание выполнить,"Кто с эксель в ладах? Нужно легкое задание выполнить.
Пишите я уточную что конкретно.",3 000 р.,1970-01-01,20,9,Для Бизнес-аккаунтов
RFID система для учета инструмента,"Разработка системы считывания инструмента, уложенного в ложементы металлических модулей. Отображение информации о наличии/отсутствии инструмента на экране планшета.",Договорная,1970-01-01,13,4,Для Бизнес-аккаунтов
Разработать мобильное приложение под Android,ДОбрый день! В проект требуется middle/ middle+/ senior android разработчик на фулл-тайм занятость (ориентировочная загрузка 40-45 часов в неделю) В ПЕРСПЕКТИВЕ ПОТ…,Договорная,1970-01-01,31,6,Для Бизнес-аккаунтов
Нужен программист для доработки и техподдержки сайта,Сайт интернет-магазина мебели. Самописная CMS. В настоящее время нужно выполнить ряд работ по прилагаемому ТЗ. В дальнейшем будет требоваться постоянная техподдержк…,Договорная,1970-01-01,33,11,Для Бизнес-аккаунтов
Разработка дизайна основной страницы сайта экономической игры,"Требуется разработка дизайна основной страницы сайта экономической игры с вводом-выводом средств. Тематика - криптовалюты, майнинг. Дизайн чистый, простой, но не ми…",Договорная,1970-01-01,125,54,Безопасная Сделка
