title,task,cost,date,views,answers,status
Приложение для вечеринок,"Приложение-игра для iOS и Android. Список основных фич:
- Login with Instagram + возможность доставать список подписчиков
- Создание общей сессии для нескольких и…",Договорная,1970-01-01,20,11,Для Бизнес-аккаунтов
Целевые подписчики VK/ Instagram,Приглашение целевой аудитории в группу из тематических по необходимому направлению групп.,Договорная,1970-01-01,22,16,Для Бизнес-аккаунтов
Зонирование многопрофильного медицинского центра,Зонирование мед центра,3 000 р.,1970-01-01,35,12,Для Бизнес-аккаунтов
Создать мультфильм,"Нужен веселый, детский мультик (обучающие или в виде игры, можно музыкальные). Ищу человека на долгое сотрудничество. Пишите цены.

P.S: для примера какие должны …",Договорная,1970-01-01,19,11,Для Бизнес-аккаунтов
Нужно доработать сценарий к видеоролику,У нас есть наброски сценария для съемок небольшого рекламного проекта. Нам нужно его грамотно довести до ума.,Договорная,1970-01-01,13,6,Для Бизнес-аккаунтов
Доработки по фото (сайт на Joomla),"Доработки по сайту (сайт на Joomla ) в соответствии с подробным техническим заданием (см. прикреплённый вордовский файл).

Бюджет 2100 руб., срок 3 дня. Работаем …",2 100 р.,1970-01-01,55,13,Безопасная Сделка
выкупить картинку,"Всем привет!
Ребят срочно надо выкупить картинку (нужен вектор)
200р на сбер

https://www.shutterstock.com/image-illustration/burning-star-51174178",200 р.,1970-01-01,43,13,Для Бизнес-аккаунтов
Простой красивый сайт за неделю / максимум 10 дней,Простой красивый сайт за неделю / максимум 10 дней. Тематика - финансовая грамотность. Спасибо!,Договорная,1970-01-01,89,70,Для Бизнес-аккаунтов
Выполнить упаковку группы,"Выполнить упаковку группы по школе английского 
- Обложка
- Аватарка
- Приветственный баннер (для закрепа)
- Товары (11 шт, по шаблону можно)
- Виджеты иконки …",2 000 р.,1970-01-01,53,21,Для Бизнес-аккаунтов
Креатив для Инстаграмм,"Нежно сделать креатив в стиле скандальной рекламы рибок - присядь на лицо.... 
из фотографий которые есть в наличии. 

В ближайшее время таг же понадобятся креат…",Договорная,1970-01-01,50,14,Для Бизнес-аккаунтов
Сайт для салона красоты,Необходимо полностью переделать сайт салона красоты. Drupal. www.salonfiolet.ru,Договорная,1970-01-01,124,100,Для Бизнес-аккаунтов
Android-разработчик с Backend Experience,"Требуется опытный разработчик Android с опытом работы над BFF и высококвалифицированным специалистом:

Java 8
MVVM
Привязка данных
Dagger 2
Rx Java 2
Модифик…",Договорная,1970-01-01,14,4,Для Бизнес-аккаунтов
Решить 4 задачи по высшей математике,Решить 4 задачи по высшей математике,250 р.,1970-01-01,6,3,Для Бизнес-аккаунтов
Аватар для Faceit команды(ветка CS:GO (название: Lynx Esports.GG)),Аватар для Faceit команды(ветка CS:GO (название: Lynx Esports.GG)),100 р.,1970-01-01,19,5,Для Бизнес-аккаунтов
Раскрутка бьюти аккаунта инстаграм,Необходимо раскрутка бьюти аккаунта (введение+таргет),Договорная,1970-01-01,31,26,Для Бизнес-аккаунтов
Аватар для Faceit команды(ветка CS:GO (название: Lynx Esports.GG)),Аватар для Faceit команды(ветка CS:GO (название: Lynx Esports.GG)),100 р.,1970-01-01,16,5,Для Бизнес-аккаунтов
Сделать сайт каталог на тильде,"Доброго времени суток  Необходимо сделать сайт-каталог. Проблема: Каталог хранился в облаке, клиенты не всегда могли просматривать и неудобно. Решение: Нужен одност…",1 000 р.,1970-01-01,43,29,Для Бизнес-аккаунтов
"Индексация сайта, прописать метатеги, добавить фавиконку, корректный title, open graph теги, семантическую разметку, толковый сниппет итд итп","Тема сайта- офисные перегородки из алюминия и все что рядом

проиндексировать сделанный сайт , прописать теги , титтле, итд, убрать ошибки
constanta-group.net
…",Договорная,1970-01-01,29,13,Для Бизнес-аккаунтов
Требуется человек с инженерными навыками способность смоделировать душ для 3Д печати.,Требуется человек с инженерными навыками способность смоделировать душ для 3Д печати.,Договорная,1970-01-01,49,5,
"Требуется инженер, способный спроектровать душ для 3Д  печати","Здравствуйте, нужен инженер, способный спроектировать и далее поправить с инженерной точки зрения душ для 3Д печати",Договорная,1970-01-01,36,4,
SEO продвижение интернет магазина,"Добрый день. Наш сайт bnt-video.ru 
На сайте представлено более 13000 позиций. Регулярно добавляется новые карточки товаров. Все эти позиции индексируются в Яндекс…",13 000 р.,1970-01-01,47,40,Для Бизнес-аккаунтов
Комментарии на сайт,"Требуется писать комментарии для сайта.

Пишите на пoчтy - mr.text собачка мейл ру.

Тематика комментариев: банковские гарантии, факторинг, эквайринг. Уникально…",Договорная,1970-01-01,107,3,
Бот Betfair API,"Здравствуйте, нужно сделать бот Betfair API, скопировать одну стратегию из бота betdriver. Стартегия называется ""первый в очереди"". 
Скачать с сайта betd…",Договорная,1970-01-01,13,1,Безопасная Сделка
Разработка логотипа для химчистки мебели.,Нужно разработать простой и понятный логотип для химчистки мебели.,2 500 р.,1970-01-01,110,97,Для Бизнес-аккаунтов
чертеж клетки для питомника,"необходим четкий профессиональный чертеж со всеми размерами,скорее для конструктора работа,не дизайн",Договорная,1970-01-01,16,6,Для Бизнес-аккаунтов
Дизайнер в косметическую компания,"Привет!
В косметическую компания требуется дизайнер на фриланс для разработки этикеток для нашей новой продукции + дизайн для полиграфии, баннеры для соц.сетей",Договорная,1970-01-01,105,70,Для Бизнес-аккаунтов
Построение лекал одежды,"Сделать градацию лекал платья, исправить надписи. Есть в наличии лекало в формате пдф",2 000 р.,1970-01-01,22,7,Для Бизнес-аккаунтов
Импорт объектов на сайт через XML,"Нужно настроить и выполнить импорт объектов недвижимости с других 2х сайтов которые предоставляют XML ссылку.
Сайт на который нужно импортировать wordpress.
Импор…",Договорная,1970-01-01,17,4,Для Бизнес-аккаунтов
Разработка бота,"Нужно создать игровой бот для телеграма 
 
Игра с интеграцией онлайн-кассы: 
2 участника для начала игры делают ставки по X руб. 
 
Кто выиграл-получает большу…",Договорная,1970-01-01,49,3,
Ищем дизайнера постов для страницы инстаграм,Требуется дизайнер постов в инстаграм,Договорная,1970-01-01,72,48,Для Бизнес-аккаунтов
"Создать новый текст на песню ""Заплатите ведьмаку чеканной монетой""...","Здравствуйте! Требуется придумать новый текст песни о ведьмаке ""Чеканная монета"". В основу текста должно лечь любое правило русского языка, тем самым, что…",Договорная,1970-01-01,141,16,
Переработка движка фриланса под движок стартапов,"Необходимо произвести переработку движка согласно ТЗ (во вложении).
Демо движка для работы: http://kw1.buystartup.ru/",5 000 р.,1970-01-01,10,3,Для Бизнес-аккаунтов
Акварельный портрет,Здравствуй! Если отлично владеешь Фотошопом и можешь нарисовать портрет в акварельном стиле - тебе к нам. Возможность долгострочного сотрудничества. Желательны прим…,45 000 р.,1970-01-01,60,20,Для Бизнес-аккаунтов
Нужен сайт танцевальной студии,"Примерно так нужно:
https://dancestudio.best/",5 000 р.,1970-01-01,101,64,Для Бизнес-аккаунтов
Проектирование глэмпинг-отелей,"Ищем специалиста по проектированию инженерных решений для кемпинг-отелей(водозабор, водоотведение, электричество). Приветствуется специалист с реальным опытом строй…",Договорная,1970-01-01,10,3,Для Бизнес-аккаунтов
Монтаж видео,Необходимо качественно обработать видео. Более подробно в личку в ТЗ.,Договорная,1970-01-01,43,30,Для Бизнес-аккаунтов
Разработка сайта и мобильного приложения,"Необходимо разработать сайт аналог dom-bez-zabot.net и мобильное приложение. Нужна консультация как правильно составить ТЗ, поэтому чтоб иметь представление привожу…",Договорная,1970-01-01,80,57,Для Бизнес-аккаунтов
нарисовать портрет,требуется нарисовать портрет с исходника в стиле арт для печати на майке,300 р.,1970-01-01,39,13,Для Бизнес-аккаунтов
Администратор Инстаграм,"В компании SMM-Group открыта вакансия - администратор Инстаграм. Мы приглашаем в нашу команду специалиста по продвижению в Инстаграм, кто уже ранее имел опыт админи…",18 000 р.,1970-01-01,20,8,Для Бизнес-аккаунтов
Вечные ссылки на сайт,"Нужны вечные ссылки на сайт икс донора от 100 , тематика строительство продажа жби изделий. spbgbi.ru",Договорная,1970-01-01,11,1,Для Бизнес-аккаунтов
Дипломная работа,Требуется написание дипломной работы,Договорная,1970-01-01,15,6,Для Бизнес-аккаунтов
Художник на графический роман,"Ищем художника для создания графического романа в комиксовой стилистике. 
Пишите по ценам за один кадр и по времени сколько займет рисование одного кадра.",Договорная,1970-01-01,45,18,Для Бизнес-аккаунтов
Создание сайта доски обьявлений по недвижимости,"Нужно создать сайт: доска обьявлений по аренде, продаже недвижимости с возомжностью размещения обьявлений пользователем.  В принципе по функционалу ничего нового, в…",Договорная,1970-01-01,65,56,Для Бизнес-аккаунтов
Бухгалтер,"Нужен бухгалтер ИП по УСН, патенту. Помощь взаимодействия с налоговой.",Договорная,1970-01-01,8,3,Для Бизнес-аккаунтов
Видеомонтажер на длительное сотрудничество,"Требуется монтировать ролики, делать все качественно и в установленный срок. Ролики есть как для инстаграма, так и для ютуб канала. Портфолио обязательно.",3 000 р.,1970-01-01,47,31,Для Бизнес-аккаунтов
Чистая верстка / Интеграция с Wordpress,"Есть простые прототипы psd-формата, которые нужно чисто сверстать и интегрировать с Wordpress. Задача простая, ""тестовая"" в каком-то смысле. При успешном …",7 000 р.,1970-01-01,60,34,Для Бизнес-аккаунтов
"Создать прототип, редизайн и улучшение юзабилити","Цель: Увеличение заказов с сайта
Задача: Улучшить удобство сайта, доработать или изменить дизайн сайта, сделать мобильную версию сайта, интегрировать с CMS Amiro …",10 000 р.,1970-01-01,68,33,Для Бизнес-аккаунтов
Ищем в команду PHP разработчика.,"Здравствуйте! Мы ищем в команду PHP разработчика. 
На удаленную работу, на полный рабочий день.
Задачи:
Сопровождение и совершенствование текущих проектов компан…",Договорная,1970-01-01,18,3,Для Бизнес-аккаунтов
Оператор на Онлайн Чат,"Требуются операторы на чат в сферу подборов и бронирования столиков в ресторанах Москвы)

График работы 2 через 2
смены с 10-00 до 18-00 и с 15-00 до 23-00 по Мо…",15 000 р.,1970-01-01,85,5,
Дизайн вывесок,"Здравствуйте, необходимо сделать дизайн 2 вывесок. 

Пишите цену - без нее предложения не рассматриваю. 

Если есть вопросы, то задавайте их сразу при подаче за…",Договорная,1970-01-01,98,51,Для Бизнес-аккаунтов
Написание контента для соц.сетей детской школы англ. языка,"Приветствую!
Ищем человека в команду, который может красиво, стильно узнаваемо писать посты. Главное слово- СТИЛЬ.
Создание контента для соцсетей (одинаковый на в…",6 000 р.,1970-01-01,32,9,Для Бизнес-аккаунтов
Создание подборок товара для мейл-рассылки,"Необходимо создание интересных, креативных подборок товаров с сайта www.plams.ru и подготовку письма для мейл-рассылки.
Шаблоны есть!",Договорная,1970-01-01,18,4,Для Бизнес-аккаунтов
Запуск Школы этикета в социальных сетях,"Нужен опытный и эффективный smm-специалист!
Задачи:
• узнаваемость бренда
• продажи франшизы
• продажи классных часов
• привлечение клиентов на тренинги в Моск…",Договорная,1970-01-01,28,15,Для Бизнес-аккаунтов
Запрограммировать калькулятор,"Здравствуйте!

Срочно нужно запрограммировать калькулятор (скриншот прилагается), интегрировать с вп, сделать расчёт по результатам, выбранных позиций и отправить…",Договорная,1970-01-01,45,16,Для Бизнес-аккаунтов
Помогите где достать index.php,"Здравствуйте! Помогите советом уважаемы гуру. Установил через базу данных OC Store после установки по переходу сайта выдает такое:

В корневой папке сайта нет инд…",Договорная,1970-01-01,21,7,Для Бизнес-аккаунтов
"УТП для РК на Яндекс.Карты, 2 ГИС.","Задача: 
1) Навести порядок в рекламных кабинетах Яндекс. Справочник, 2 ГИС, Гугл.Справочник.
2) Сформировать УТП на звонки и посещение в офисов продаж.  
3) Обн…",Договорная,1970-01-01,7,1,Для Бизнес-аккаунтов
Web Программирование. Агрегатор.,"Доброго времени суток,
Для написания программного обеспечения необходим универсальный программист, имеющий успешный опыт работы с достаточными знаниями Backend, Fr…",Договорная,1970-01-01,19,7,Для Бизнес-аккаунтов
Нарисовать портрет по фотографии,"Ищу художника, который нарисует портрет в электронном виде по фотографии человека.
Желательно посмотреть примеры ваших работ.",1 000 р.,1970-01-01,35,22,Для Бизнес-аккаунтов
Отслеживание в Google Аналитика кликов по внешним ссылкам при рассылке из почты gmail,"Есть электронная рассылка писем из почты gmail, в письме есть ссылки на внешние сайты фирм. Нужно отследить в Google Аналитика статистику кликов, т.е. переходов на …",Договорная,1970-01-01,4,1,Для Бизнес-аккаунтов
Иллюстратор для книги,"Ищу художника для иллюстрирования книги. 
Книга с рецептами, будет издаваться в электронном виде, ее объем около 30 страниц. 
Хочу разбавить текст иллюстрациями (…",2 500 р.,1970-01-01,57,33,Для Бизнес-аккаунтов
Создание сайта под ключ,"Нужно сделать сайт наподобие https://oboi-vsem.ru/
Проект долгосрочный нужен ответственный исполнитель. Прошу указывать цену и сроки исполнения.
Сайт магазин с бо…",Договорная,1970-01-01,60,40,Для Бизнес-аккаунтов
Необходим порядовщик печей из кирпича 3D,Необходим порядовщик печей 3D,Договорная,1970-01-01,17,3,Для Бизнес-аккаунтов
Участие в форуме г.Москва- знакомство и сбор контактов,"На выставочном мероприятии необходимо завестись знакомством с потенциальными партнераим, презентовать продукт, собрать контакты, раздать визитки. Работа 2 дня, кофе…",Договорная,1970-01-01,6,0,Для Бизнес-аккаунтов
"Отрисовать 2d персонажа, девушку с фото",Необходимо нарисовать девушку для анимационного ролика. Фото предоставим,Договорная,1970-01-01,49,27,Для Бизнес-аккаунтов
Срочно нужна разработка дизайна Landing page на Tilda,"Наша фирма занимается сдачей в аренд складских помещений. С холодильным оборудованием и без. 
5-7 экранов, текста предоставляем. 
Большим плюсом будет, если у вас…",Договорная,1970-01-01,93,59,Для Бизнес-аккаунтов
Ведение группы в инстаграм,"Необходмо вести и развивать группу в инстаграм, т.е.  активное выкладывание постов ( 1 раз в 7 дней) и стори ( 3-4 стори в день). Специфика группы: микрофинансиров…",Договорная,1970-01-01,21,19,Для Бизнес-аккаунтов
SEO продвижение,"Планируем разрабатывать новый сайт (Tilda, Modx, Битекрс, что-то ещё) и интегрировать его с приложением, встал вопрос про сео продвижение. Тематика сайта будет: хим…",Договорная,1970-01-01,45,32,Для Бизнес-аккаунтов
Куплю каналы яндекс ДЗЕН,"Куплю каналы яндекс ДЗЕН 
Главное требование, чтобы канал был создан до ноября 2019 года. Также могу купить каналы с ограничениями. К отклику оставьте ссылку на ка…",Договорная,1970-01-01,16,2,Для Бизнес-аккаунтов
Система авторизации на Flask (Apache),"Шаблон регистрации для приложения на Flask - 4 страницы без контента
1) Login - форма для авторизации через ввод email и пароля
2) Sign up - форма регистрации пол…",Договорная,1970-01-01,4,2,Для Бизнес-аккаунтов
Съемка в Астрахани,"Отснять контейнер для сбора отходов/ пакет с отходами по указанным адресам, 46 объектов. Адреса расположены по всему городу Астрахань. Выполнить работу нужно в разн…",Договорная,1970-01-01,10,0,Для Бизнес-аккаунтов
