title,task,cost,date,views,answers,status
Торгово-развлекательный комплекс в Катаре к ЧМ по футболу,"Ищу человека который может сделать качественую визуализацию для презентации будущего здание ТРК в Катаре. В наличии уже имеются несколько 3D рисунков, так же есть в…",Договорная,2020-02-17,9,6,Заключение договора
обновить сайт на Joomla,"Есть древний и примитивный сайт на второй Джумле, нужно обновить контент, заменить фотографии. Может найдется умелец, который еще не забыл ""старушку""? Рас…",Договорная,2020-02-17,4,3,Безопасная Сделка
Разработка backend в крутой команде. Оплата обсуждается предметно и выгодно для обеих сторон,"Нужен грамотный разработчик Back-end с опытом, способный решать трудные задачи эффективно и без потерь. В кратце нужен маркетплейс, но это очень абстрактно. Также н…",Договорная,2020-02-17,4,1,Для Бизнес-аккаунтов
"Доработка админки сайта в соответствии с ТЗ, перенос информации со старого сайта, интеграция CMS, размещение на хостинге","Делаем редизайн существующего сайта. Требуется доработать/разработать админку существующего сайта в соответствии с новой версткой и ТЗ, и интегрировать в CMS, в том…",Договорная,2020-02-17,12,4,Безопасная Сделка
YouTube парсер текста,"Использование прокси адреса.
Поиск каналов по различным запросам и по вкладке ""похожие""
Проверка на наличие определенного текста на канале. 
Сохранение…",10 000 р.,2020-02-17,24,7,Для Бизнес-аккаунтов
"работа с каталогом сайта,парсинг,дизайн чемоданов по цветам","Примерное тз по сайту 101чемодан.рф

1. добавить цвет к товару. таким образом к товару добавляются предложения. в зависимости от цвета меняются изображения товара…",Договорная,2020-02-17,10,4,Для Бизнес-аккаунтов
"Опытный конструктор, инженер, чертежник, ЕСКД, 3D","Проектирование деталей, узлов, механизмов на базе отдельных элементов и механизмов готовых образцов, создание прототипов",Договорная,2020-02-17,8,5,Для Бизнес-аккаунтов
Заказ товаров через Excel документ,"Есть сайт на ВордПресс и Excel таблица с 2000 товаров без картинок и без описание, только артикул, название, категория и цена. Необходимо, чтобы посетители сайта мо…",1 000 р.,2020-02-17,17,2,Для Бизнес-аккаунтов
Интернет маркетолог,"Мы самый крупный в России интернет-магазин по продаже татуировочного оборудования https://28opt.ru , в связи с расширением отдела, ищем интернет маркетолога.
В мар…",100 000 р.,2020-02-17,18,4,Заключение договора
Специалист Яндекс Карт API для решения задачи,"На сайте реализован функционал меток на сайте. Нужно доработать функционал.
1.	Геолокация работает некорректно, почему-то не определяет местоположение правильно.
…",Договорная,2020-02-17,21,4,Для Бизнес-аккаунтов
Разрабока Landing Page (на основе имеющихся данных по старому сайту),СФЕРА ДЕЯТЕЛЬНОСТИ КОМПАНИИ: Реализация крупных инфраструктурных проектов с применением EPC(M) механизмов в рамках государственно-частного партнерства и других форм…,Договорная,2020-02-17,108,31,Для Бизнес-аккаунтов
Схема этажей загородного дома,Спроектировать схему этажей дома. 2 этажа+мансарда.,Договорная,2020-02-17,36,19,Для Бизнес-аккаунтов
Надо обзвонить базу фермерских хозяйств России. Надо дозвониться ( это важно не с первого раза может получиться) фермеру и узнать какие культуры он будет посеял в этом году и сколько гектар.,Нам надо обзвонить базу фермерских хозяйств России. Надо дозвониться ( это важно не с первого раза может получиться) фермеру и узнать какие культуры он будет посеял…,Договорная,2020-02-17,9,0,Для Бизнес-аккаунтов
Требуется перевести игру с Flash на HTML5 или JavaScript,"Необходимо перевести игру с Flash в игру на HTML5 или JavaScript.

Игра: https://clck.ru/MEBRQ

Исходников нет, только этот swf файл.

Напишите пожалуйста, ес…",Договорная,2020-02-17,20,1,Для Бизнес-аккаунтов
Копирайтинг для лендингов мамочек и беременных,"Необходимо написать текст для товаров тематик (старые ленды):
1. Дородовые бандажи www.neobelt.waistshop.ru/premium
2. Послеродовые / утягивающие корсеты www.shan…",2 000 р.,2020-02-17,36,9,Для Бизнес-аккаунтов
Разработка гибридного Android/iOS/Web приложения на Ionic 1 Framework,"Требуется разработать приложение для торговых представителей (мерчендайзеров)
Прототип интерфейса: https://creator.ionic.io/share/35d6dcf6f9f6

Требования: https…",70 000 р.,2020-02-17,24,10,Для Бизнес-аккаунтов
Реклама в сторис (шейповая анимация),"Для салона красоты, оказывающего услуги в 6 рук (2-3-4 процедуры можно сделать одновременно за 2 часа) Требуется несколько рекламных роликов в пропорции 9:16 для ре…",Договорная,2020-02-17,37,17,Для Бизнес-аккаунтов
Выполнение работ по разработке проектной документации на ремонт объекта «Автомобильная дорога «г. Советская Гавань – рп. Ванино»  на участке км 0+000 - км 29+800»,"Выполнить работы по разработке проектной документации на ремонт объекта «Автомобильная дорога «г. Советская Гавань – рп. Ванино» 
на участке км 0+000 - км 29+800»…",Договорная,2020-02-17,5,1,Заключение договора
написать lading page,нужно написать лейдинг под скачивание файлов тематика без разницы главное заинтересовать юзера на скачку и установку приложения под windows  приветствуется опыт обх…,6 000 р.,2020-02-17,17,4,Безопасная Сделка
Требуются авторы текстов,"Для постоянного сотрудничества требуются авторы текстов. Тексты разные: информационные, о товарах, услугах с ключевыми словами, рерайт.

Работа удаленная ПН-ПТ (5…",Договорная,2020-02-17,284,14,
Срочно! Создание сайта по предоставлению услуг!,"Хотелось бы узнать примерное время для создания и примерную стоимость. Я попробую вкратце изложить свою идею.

По структуре сайт будет чем-то напоминать сайт prof…",Договорная,2020-02-17,57,30,Безопасная Сделка
Пиццерия,Существующее помещение ресторана (230 м2) требует изменение концепции и создания новой пиццерии в центре города Екатеринбурга. На сегодняшний день не требуется изме…,Договорная,2020-02-17,19,10,Безопасная Сделка
3д модель оснастки для литья в хтс,Компания занимается литьём алюминия в землю (хтс). Интересует разработка документации для изготовления оснастки для литья в хтс. Документация может включать в себя …,Договорная,2020-02-17,13,6,Для Бизнес-аккаунтов
Google SEO optimization,"Привет,

У нас есть cайт digitalaquila.com - мы специализируемся на Salesforce Marketing Cloud consulting service. Наш трафик который идет через Google очень мале…",Договорная,2020-02-17,18,8,
Instagram - Создание личного бренда. Долгосрочное сотрудничество.,"Добрый день.
Ищу SMM исполнителя на долгосрочное сотрудничество.
Интересует ведения и раскрутке instagram аккаунта. Личный бренд- пластический хирург.
Данный мом…",Договорная,2020-02-16,41,27,Для Бизнес-аккаунтов
Прорисовка,"На короткометражный анимационный фильм по мотивам рассказа ""Тёма и Жучка"" Н. Гарина-Михайловскго
срочно требуются ПРОРИСОВЩИКИ (по удалёнке).

Работаем…",Договорная,1970-01-01,4,0,Для Бизнес-аккаунтов
Разработать дизайн лендинга для производственной студии с применением графики,"Техническое задание
на разработку дизайна лендинга производственной студии 

Требуется разработать дизайн лендинга производственной студии занимающейся разработк…",15 000 р.,1970-01-01,37,25,Безопасная Сделка
Сделать шапку и логотипы телеграмм канала,"Логотип нужен, картинки под посты, оформление канала. Тематика ""Халява, Купоны""",1 000 р.,1970-01-01,20,21,Для Бизнес-аккаунтов
Нужен сайт под ключ,"Ищу специалиста по созданию сайта под ключ. Легкая графика, адаптивность под мобильные устройства, нестандартность графических решений. ТЗ нет но готов всё обяснить…",20 000 р.,1970-01-01,48,35,Для Бизнес-аккаунтов
Настройка рекламы в фейсбуке,Настроить таргетинговую рекламу в инстаграме через Фейсбук для свадебного салона.,Договорная,1970-01-01,3,5,Для Бизнес-аккаунтов
Нужно придумать логотип(строительная компания),"Нужен логотип для строительной компании(каркасное строительство).для размещения его на рекламе,аватарке,почте.",Договорная,1970-01-01,37,43,Для Бизнес-аккаунтов
"Ищем дизайнера логотипа,превью для роликов,шапки канала.","Здравствуйте, ищем дизайнера логотипа на Ютуб канал. 
В дальнейшем планируем найти человека, который будет делать : 
1) Превью для видеороликов 
2) Шапку для кан…",5 000 р.,1970-01-01,22,19,Для Бизнес-аккаунтов
Контент менеджер – ВК FB INSTA,"Есть сообщество в cоц.сетях

Тематика: музыкальная группа – если Вы разбираетесь в музыке это будет плюсом (жанр – русский рэп)
Необходимо подготавливать посты ,…",7 000 р.,1970-01-01,13,4,
сверстать 2сторонюю листовку а5 для пиццерии,сверстать 2-сторонюю листовку а5 для пиццерии и подготовить для печати. листовка в виде меню с фотографиями продукции и всей необходимой информацией,Договорная,1970-01-01,11,9,Для Бизнес-аккаунтов
СЕО продвижение,"Здравствуйте, ищем специалиста с опытом на постоянную работу для внутренней оптимизации сайта storieviews.com  , работы над контентом и закупки ссылок для продвижен…",Договорная,1970-01-01,11,4,Для Бизнес-аккаунтов
Проект внедрения адресного хранения на складе,"Внедрение проекта динамического адресного хранения товаров на складе 1400 кв.м. Высота стеллажей - 8м.
Учетная система - 1С УПП 8.3.
Интенсивность работы склада -…",300 000 р.,1970-01-01,12,2,Заключение договора
Фирменный стиль и логотип,"Дизайн коробки ,средства для волос , плис логотип",3 000 р.,1970-01-01,39,27,Для Бизнес-аккаунтов
Шапка и аватарка группы ВК,Необходимо создать какую-нибудь несложную шапку группы для ВКонтакте и аватарку с использованием абривеатуры EABOX,500 р.,1970-01-01,19,8,Для Бизнес-аккаунтов
на сайте ModX настроить форму обратной связи,Нужно чтоб передавались поля выбор врача и выбор направления в форме обратной связи. Сейчас этого почему-то нет. Раньше форма работала правильно. Сейчас письмо прих…,Договорная,1970-01-01,11,3,Для Бизнес-аккаунтов
Найти номер отслеживания почтового отправления,Необходимо чтобы специалист написал программу/сервис которая сможет методом подбора вычислить и проверить результат. Необходимо найти отслеживание заказного письма …,Договорная,1970-01-01,7,2,Для Бизнес-аккаунтов
Пользовательское соглашение для платного телеграм бота,"Пользовательское соглашение для платного телеграм бота с индивидуальными гороскопами.
 
Типовое соглашение о предоставлении платной информации (по модели подписки…",Договорная,1970-01-01,1,0,Для Бизнес-аккаунтов
Перевести письмо с русского на английский,Перевести письмо. Размер не больше 1 страницы А4.,500 р.,1970-01-01,9,7,Для Бизнес-аккаунтов
Нужен специалист по подбору кадров,Требуется удаленный специалист по подбору кадров в новый кулинарный проект по доставке продуктов. Требуется находить сотрудников на задания и на постоянную работу. …,5 000 р.,1970-01-01,1,0,Для Бизнес-аккаунтов
завтра 18.02 в первой половине дня по мск сделать перевод (прим. а4). Текст будет готов к утру.,"к утру, прим. 11 по мск подготовим текст и нужно будет его оперативно перевести часам к 16-по мск 18.02. объем прим. а4.",Договорная,1970-01-01,5,3,Для Бизнес-аккаунтов
Ищем копирайтера (Крипто-проект),"Ищем на долговременной основе копирайтера для проекта ""Крипто-обменник"". 
Если вам близка крипто-тема и вы понимаете о чем речь, то будем рады  рассмотре…",Договорная,1970-01-01,6,2,Для Бизнес-аккаунтов
Категорийный менеджер,"Ищем менеджера категорий (у нас много направлений, поэтому пишите в какой категории товаров у Вас есть опыт.
Обязанности:
искать поставщиков с наиболее выгодными …",30 000 р.,1970-01-01,2,0,Для Бизнес-аккаунтов
Монтаж готовых исходников,"Полный монтаж(музыка,переходы,эффекты и все это как у более блогеров под тизерный вариант)
Исходники готовые, общая масса получится примерно на 1-2 минуты полного …",300 р.,1970-01-01,15,10,Для Бизнес-аккаунтов
Обработка фотографий с 3D моделированием объектов и размещении объектов на фото.,"В приложении описание технологии и фото.

Надо смоделировать изделие (заграждения), разместить на фото таким образом, чтобы это показало систему в работе, и убрат…",Договорная,1970-01-01,18,8,Для Бизнес-аккаунтов
Сайт - лендинг под клининг,Нужен полностью готовый сайт к работе.,3 500 р.,1970-01-01,84,43,
Старший менеджер по продажам B2B,"Требуемый опыт работы: 1–3 года

Полная занятость, удаленная работа

Внимательно прочитать до конца и выполнить задания указанные в вакансии.
Ведётся набор мен…",100 000 р.,1970-01-01,3,0,Для Бизнес-аккаунтов
Рассчитать бетонный бассейн для хранения воды,"Здавстуйте!
Необходимо рассчитать бетонный бассейн для хранения воды. 
Размеры бассейна 125000х 145000х 27000 (ДШВ, мм)
Размещение надземное на бетонной плите.
…",Договорная,1970-01-01,7,1,Для Бизнес-аккаунтов
Разработка индивидуального календаря (органайзера) руководителю,В организации используется органайзер (календарь) в целях упорядочивания работы руководителя. Используется как информационная база мероприятий (как прошедших так и …,Договорная,1970-01-01,10,0,Для Бизнес-аккаунтов
Синхронизировать по API ocstore,"Движок сайта на OCSTORE.

Технически API интерфейс реализован как семейство Web методов с обязательной
авторизацией.
Поддерживаются два формата обмена
Формат J…",Договорная,1970-01-01,8,3,Для Бизнес-аккаунтов
Необходимо написать две статьи на тему спорта,"Срочная работа!!! 
Необходимо выполнить работы по теме ""Педагогика и спорт. Прогнозирование и тенденции различных видов спорта"" и ""Теория и практик…",Договорная,1970-01-01,12,4,Для Бизнес-аккаунтов
Наполнить сайт товарами,Необходимо заполнить интернет магазин цветов товарами. Самописный движок. База в csv файле. Возможна оплата за каждые n-позиций. Можно наполнять как руками так и ав…,2 000 р.,1970-01-01,16,1,
Написать честный отзыв на приложение,"Написать честный отзыв на приложение Супермама - supermama.io
Разместить на irecommend, Отзовик",200 р.,1970-01-01,7,1,Для Бизнес-аккаунтов
Продвижение страницы в Инстаграмме,"Не большое продвижение страницы в инстаграмм с товарами ручной работы. Реклама,коменты. Работы не много,пишите за сколько готовы сделать работу на день-два.",Договорная,1970-01-01,18,7,
Лидогенерация в консалтинговую компманию по продажам,"Ищу специалистов с успешным опытом настройки рекламных компании для консалтинговых компаний в нише «Продажи» 
Детали компании тут  -  Kovtunenko.com 
Продукт орие…",Договорная,1970-01-01,9,3,Для Бизнес-аккаунтов
Переделать имеющийся магазин Shopify,"Переделать имеющийся магазин Shopify под другую продукцию (до 10 продуктов, фото и описание есть). Подключить магазин к другому домену.",Договорная,1970-01-01,28,11,Для Бизнес-аккаунтов
Установить шаблон сайта Opencart,"Нужно установить шаблон сайта опенкарт, шаблон https://lightshop2.899themes.ru/ , чтобы было все как в демо.",300 р.,1970-01-01,7,3,Для Бизнес-аккаунтов
Проект апарт-отеля,"нужно сделать план 1-го этажа, типового этажа, генплан и фасады. есть задание, местность, все отправлю.",3 000 р.,1970-01-01,25,7,Для Бизнес-аккаунтов
