title,task,cost,date,views,answers,status
Сервер CentOS+ISP Manager  решить проблему,"Сервер CentOS + ISP Manager - сервер подключен через роутер Mikrotik , настроен Nat но сайт работающий на этом сервере извне не открывается

Telegram ···",1 000 р.,1970-01-01,36,7,
Бэкап VPS сервера Beget,"Необходимо сделать копию сервера со всеми данными с возможностью развернуть на другом vps.
Текущая ОС: Ubuntu 18.04
Дополнительное ПО: LAMP",Договорная,1970-01-01,13,7,Для Бизнес-аккаунтов
Оптимизация сайта,"Нужна оптимизация, а возможно и аудит сайта libertate.ru и аналогично dneprkomfort.dp.ua
Цены, сроки и тд
Полная объемная информация

Сразу пишите в телеграмм ·…",Договорная,1970-01-01,57,11,
Ищем менеджера по продажам,"Ищем менеджера по продажам .
Что продавать? 
- Минитракторы и другую технику для сельского хозяйства и строительства

Кому  продавать?
 - Фермерам, ИПшникам, с…",15 000 р.,1970-01-01,13,2,Для Бизнес-аккаунтов
Написание и размещение постов в ВК,"Задача
Необходимо уметь писать интересные уникальные мини посты(будет проверка на уникальность) в группах согласно тематики группы и ЦА.
Посты должны мотивирова…",6 000 р.,1970-01-01,26,4,Для Бизнес-аккаунтов
Удаленный Администратор по работе с клиентами,"Работа с клиентами удаленная по интернет и телефону. 
Частичная занятость (3-4 часа в день, понедельник - пятница).

Что делать:
Общаться с клиентами по телефон…",Договорная,1970-01-01,7,0,Для Бизнес-аккаунтов
Импорт и настройка почты с яндекса в gmail (gsuit),"Настроить импорт в Gmail почту Яндекс для получения и отправки сообщений
Настроить подписи
Настроить псевдонимы",Договорная,1970-01-01,7,2,Для Бизнес-аккаунтов
Конвертор моделей для GTA 5,"Требуется конвертор моделей авто для GTA 5
vk.com/projectborsh",1 000 р.,1970-01-01,16,2,Для Бизнес-аккаунтов
Тексты для карточек товаров. Электроника.,"Необходимо писать тексты для карточек товаров интернет-магазина электроники.

Количество по договоренности. Оплата по мере выполнения задания (1 карточка = 100 ру…",Договорная,1970-01-01,36,5,Для Бизнес-аккаунтов
Работы по настройке скорости работы сайта,Отладка и настройка скорости работы интернет магазина на битрикс,Договорная,1970-01-01,21,12,Для Бизнес-аккаунтов
"Написание текстов к постам, постинг и ответ клиентам в качестве тех. поддержки","Мы ищем человека, который готов прогрузиться полноценно в проект
Нужно заниматься публикацией материала в социальных сетях (посты и репосты), отвечать на сообщения…",28 000 р.,1970-01-01,24,5,Для Бизнес-аккаунтов
Разработка нового сайта дизайн в PSD,"Нужен человек с богатым опытом разработки макетов. ( прошу не откликаться тех у кого нету опыта.)
Который может обосновать почему добавил тот или иной блок сюда и …",10 000 р.,1970-01-01,131,49,Для Бизнес-аккаунтов
Комплектация дизайн-проекта мебелью,"Приглашаю к сотрудничеству дизайнеров интерьера.
Наша компания занимается комплектацией мебелью объектов как физических, так и юридических лиц.

1. Широкий ассор…",Договорная,1970-01-01,35,7,Для Бизнес-аккаунтов
Сайт столовой,"Требуется создание сайта столовой.
Меню по дням недели с возможностью лайкать/дизлайкать блюда любого дня недели.
Блюда будущего дня - хочу/не хочу
Блюда текущег…",Договорная,1970-01-01,115,62,Для Бизнес-аккаунтов
Проектирование пожарной сигнализации,"- основание для разработки проекта;
- характеристика защищаемого объекта;
- описание основных технических решений, принятых в проекте;
- общее описание функциони…",Договорная,1970-01-01,9,1,Для Бизнес-аккаунтов
Контент-менеджер для социальных сетей,"Ищем специалиста для ведения социальных сетей бренда косметики VIPTA

– Разработка контент-плана на неделю: текст, фото, интерактив, теги
– Размещение контента в…",Договорная,1970-01-01,30,19,Для Бизнес-аккаунтов
Куплю Дзен каналы,"Куплю монетные и без монетные дзен каналы.
Рассмотрю все варианты.
Куплю без монетные созданные до 2020 г. Желательно с публикациями.
Обязательно укажите ссылку …",3 000 р.,1970-01-01,17,2,Для Бизнес-аккаунтов
Сделать аудит сайта.,"Нужно сделать комплексный аудит , для выявления технических ошибок для сайта.",3 500 р.,1970-01-01,38,28,Для Бизнес-аккаунтов
Раскодировать программу,"1)Раскодировать прогрмму 
2)Обойти ключ 
Работаем через безопасную сделку. 
СВЯЗЬ!!!!!!
ДИСКОРД(semkatm#7572)
телеграмм(···
СКИДЫВАЮ ПРЕДОПЛАТУ ТОЛЬКО ПОСЛЕ Т…",1 500 р.,1970-01-01,24,1,Для Бизнес-аккаунтов
"1с программист (Интеграция посредством HTTP сервиса, обмен данными через формат JSON)","Версия 1с 8.3.13.1690
Конфигурация Бухгалтерия предприятия, Редакция 3.0.70.33 

Необходимо настроить обмен данными между 1с и торговым терминалом (вендинговым а…",Договорная,1970-01-01,33,6,Безопасная Сделка
Поисковая оптимизация сайтов под западный сегмент,"Стоимость проекта обсуждается, в зависимости от вашего опыта.
Нужно сделать ТЗ для 2 сайтов по бытовым услугам с учетом всех нюансов SEO. Один сайт для Германии (у…",Договорная,1970-01-01,39,21,Заключение договора
"Разработка фирменного стиля компании, логотип, оформление сайта под фирменный стиль","Требуется разработать фирменный стиль компании, логотип, брендбук (дизайн сайта компании).",Договорная,1970-01-01,101,63,Для Бизнес-аккаунтов
Писатель-копирайтер,"Кого ищем?
Сотрудника на полный рабочий день - желательно не удалёнщика, но рассмотрим любые адекватные варианты.

Что нужно делать?
Создание различного и, в то…",Договорная,1970-01-01,37,11,Для Бизнес-аккаунтов
"Записать видео 3-5 штук, парень с нормальной внешностью нужен, запись видео + еще пару задач будет. Пишите в телеграмм",Пишите в личку телеграмм расскажу подробнее ···,Договорная,1970-01-01,47,0,
ПЕРЕВОД ПРЕЗЕНТАЦИИ С РУССКОГО НА АНГЛИЙСКИЙ (СРОЧНО),"Добрый день!
Необходимо срочно перевести с русского на английский текст презентации о компании (обращение генерального директора и компетенции).",Договорная,1970-01-01,22,11,Для Бизнес-аккаунтов
"Разработка страницы ""под ключ"" для сайта на Wordpress","Разработка страницы для готового сайта. CMS Wordpress. Дизайн, верстка, посадка на CMS. Во вложении ТЗ.

Работаем по договору с только юр.лицами/самозанятыми, без…",Договорная,1970-01-01,43,19,Для Бизнес-аккаунтов
Срочно нужно разработать html письмо для рассылки,"Техническое Задание: срочно нужно разработать html письмо для массовой интернет рассылки. Сделать и оформить стильно, солидно (деловой стиль) и по всем правилам поч…",1 000 р.,1970-01-01,43,18,Для Бизнес-аккаунтов
Разметка изображений для сегментации,"Добрый день. Необходимо сделать разметку 1000 изображений для сегментации. 1 изображение - 20 руб./возможно увеличение. 
 Необходимо разметку сделать качественнее,…",Договорная,1970-01-01,43,8,Для Бизнес-аккаунтов
Сделать приложение на ios,"Приложение состоит из 10 несложных экранов.  Swift
Пишите примерную цену.",Договорная,1970-01-01,13,5,Для Бизнес-аккаунтов
Нужен взрослый мужской баритон для записи демо,"Есть песни (текст, минус) социально военного характера (гимн региона, военная песня, песня о родине). Нужен исполнитель мужчина, с красивым баритоном (не сиплый). Р…",1 000 р.,1970-01-01,7,1,Для Бизнес-аккаунтов
Web-программист на проект,"В связи с развитием и увеличением объема текущих задач ищем в помощь web-программиста на проект (желательно, с продолжением сотрудничества).
Обязательно быть на св…",40 000 р.,1970-01-01,69,15,Для Бизнес-аккаунтов
Дизайн комплекта рекламных материалов для соцсетей,"Привет! 

Нужно разработать дизайн для различных макетов, главным образом для соцсетей - создать пул материалов (они перечислены в ТЗ), чтобы они все смотрелись п…",Договорная,1970-01-01,133,37,
Электроснабжение ТХ общепит,Система общепит 3 ресторана 7 кафе. ЭОМ стадия Р в полном объёме.,50 000 р.,1970-01-01,19,10,Для Бизнес-аккаунтов
Статьи для блога строительной компании,"Здравствуйте!
Ищем копирайтера на постоянной основе – будем заказывать 1-2 статьи в месяц для блога строительной компании КиевНовБуд (https://kievnovbud.com.ua/cat…",Договорная,1970-01-01,38,21,Для Бизнес-аккаунтов
Постинг контента в группу,"Требуется публикация 30 постов в группу. Направление - музыкальное обучение
Схема работы следующая
- Делаете контент-план исходя из вводных (исполнителю пришлю)
…",Договорная,1970-01-01,14,2,Для Бизнес-аккаунтов
Повышение узнаваемости бренда,"На российский рынок выводится немецкий бренд строительной тематики, необходим специалист, готовый взяться за его продвижение и повышение узнаваемости среди целевой …",Договорная,1970-01-01,27,16,Для Бизнес-аккаунтов
Лендинг на платформе getcourse,"Создать  лендинг онлайн-курса на getcourse. Минималистичный, стильный,  без излишней графики. Настроить и прикрутить его уже к существующему курсу. Возможно дальней…",10 000 р.,1970-01-01,230,38,Безопасная Сделка
Настройка и ведение тизерных сетей,"Добрый день!  

Необходимо настроить и вести тизерные сети.  
Финансовая тематика, а именно займы, кредитование итд.  

Присылайте ваши расценки, способы работ…",10 000 р.,1970-01-01,31,8,
Фото- видеосъемка в г. Ульяновск,"4К и стедикам!

Фото- видеосъемка по сценарию
docs.google.com/document/...

Адрес:
г. Ульяновск

В заявках указываем:
1. Срок и стоимость.
2. Ваше оборудо…",99 999 р.,1970-01-01,5,0,Для Бизнес-аккаунтов
Elegante,"Задача: разработать логотип для бренда женской одежды.
Elegante – бренд женской одежды.Elegante в переводе с итальянского элегантный,шикарный, изящный,стильный, гр…",Договорная,1970-01-01,99,75,Для Бизнес-аккаунтов
Фишгор -  магазин товаров для отдыха и рыбалки,"ВНИМАНИЕ! Авто ответы и предложения других бюджетов не интересуют и рассматриваться не будут. Убедительная просьба, если у Вас нет мыслей не тратье не мое не чужое …",3 000 р.,1970-01-01,80,28,Для Бизнес-аккаунтов
Отрисовать баннер на сайт,Необходимо отрисовать баннер с детскими кроватками-домиками в фирменном стиле.,9 500 р.,1970-01-01,117,65,Для Бизнес-аккаунтов
сделать фильтр на корпоративном сайте на 1С Битрикс,"Нужно сделать фильтр по портфолио без перезагрузки страницы. Макет пришлю заинтересованным.

Работать для пользователя должно следующим образом: 
По клику на фил…",Договорная,1970-01-01,26,10,Для Бизнес-аккаунтов
Ресайзы HTML5 баннера,"Фактически необходимо сделать ресайз на разные площадки в нужных размерах.
Готовые файлы по ссылке we.tl/t-hnaMZUGOOK
Там же есть исходник в Photoshop
И шрифты
…",5 000 р.,1970-01-01,22,9,Для Бизнес-аккаунтов
создать аудио трек,"нужно создать аудио файл в Mp3 формате. Тематика шум от соседей, т.е. нужно найти в интернете глухие звуки топота и глухих ударов одиночных и иногда не одиночных и …",Договорная,1970-01-01,22,11,Для Бизнес-аккаунтов
Переработка свойств и фильтра,"Здравствуйте. На проекте который находится в разработке, необходимо переработать свойства объявлений, сделать связные свойства

Так, что бы при выборе фильтра, по…",15 000 р.,1970-01-01,17,6,Для Бизнес-аккаунтов
Дизайн коммерческого помещения 80 кв м,"Дизайн интерьера для помещения 80 кв на цокольном этаже жилого дома. Одним большой зал.
Под компьютерный клуб. Начальное количество компьютеров - 20. Ориентировочн…",Договорная,1970-01-01,37,19,Для Бизнес-аккаунтов
Разработать флаер по детскому товару,Требуется разработать флаер по детскому товару,Договорная,1970-01-01,91,66,Для Бизнес-аккаунтов
Сшить детский купальник,Сшить простой детский купальник.,Договорная,1970-01-01,3,1,Для Бизнес-аккаунтов
С++ автоматизация работы с площадками,"Требуется бот-рассыльщик для массовой публикации обьявлений на фл.
Задача: размещение множества обьявлений на разных сайтах через единый интерфейс,
для взаимодейс…",8 900 р.,1970-01-01,43,4,Безопасная Сделка
Расчет перекрытия,Рассчитать несущую способность  ж/б перекрытия встроенной антресоли на металлических балках для установки технологического оборудования. При неблагоприятном результ…,Договорная,1970-01-01,10,2,Для Бизнес-аккаунтов
Написать решение задаче по С,"Есть определённые задачи, нужно написать программы, которые будут их выполнять.",5 000 р.,1970-01-01,10,3,Для Бизнес-аккаунтов
Интеграция верстки магазина (+парсер) на OpenCart или ModX (смотри скриншот),"Всем привет, есть готовая верстка магазина, которую надо: 

1) установить и интегрировать на ModX (evo/revo) или OpenCart

2) разово запарсить товары с сайта пр…",Договорная,1970-01-01,26,12,Для Бизнес-аккаунтов
Социологическое исследование,Разработка опроса от сценариев и развилок до текста вопросов и визуального дизайна,Договорная,1970-01-01,20,6,Для Бизнес-аккаунтов
Требуется грамотный анализ и продвижение моего сайта,"Требуется анализ сайта,исправление ошибок, хорошая работа сайта,подгонка.
Продвижение сайта,увеличение посещаемости- заказов
поддомены по РФ
ПРОСЬБА ПИСАТЬ ЛИЧНЫ…",20 000 р.,1970-01-01,52,24,Для Бизнес-аккаунтов
Сменить дизайн в магазине на БИТРИКС,"необходимо заменить дизайн, пока что главной страницы, есть прорисовка в 3 разрешениях. Бюджет 5 т.р., оплата по факту. прошу указывать скайп или вотсап.",5 000 р.,1970-01-01,21,8,Для Бизнес-аккаунтов
Тексты для соц.сетей,"Необходимо писать 8 текстов в неделю для соц сетей: инстаграм, вк 
Тексты по разным, популярным темам 
Главное: чтобы соц.сети всплывали при СЕО оптимизации в пои…",1 000 р.,1970-01-01,24,11,Для Бизнес-аккаунтов
Flutter приложение для CRM,"Есть CRM на yii2 (rest api документирован на swagger) под него нужно кроссплатформенное приложение на Flutter.

ФУНКЦИИ: 
- Регистрация
- Авторизация по номеру …",40 000 р.,1970-01-01,27,3,Заключение договора
Дизайн кафе-кондитерской,"Необходимо разработать дизайн проект для кафе-кондитерской, свет, отопление, электрика, смета , разработка организация рабочего пространства, размещение посадочных …",100 000 р.,1970-01-01,222,33,Заключение договора
Тексты для постов в инстаграм по готовым тематикам (астрология),"Нужно написать 30 небольших текстов (стандартный размер поста инстаграм +/-) для портала по астрологии

Тематики постов уже составлены
Текст должен быть простой,…",3 000 р.,1970-01-01,23,7,Для Бизнес-аккаунтов
Тексты для соц.сетей,"Необходимо писать тексты для соц.сетей. 8 текстов в неделю. 
Темы различные. На популярные темы. 
Не более 1500 знаков 
Основаная цель: СЕО оптимизация аккаунтов…",1 000 р.,1970-01-01,22,8,Для Бизнес-аккаунтов
отрисовать изображение,отрисовать изображение 3д барельефа цветного в хорошем качестве.,Договорная,1970-01-01,52,10,Для Бизнес-аккаунтов
Переверстка рекламного банера,Запускаем точку выдачи DUTY Free товаров в магазине. Для оформления заказали разработку дизайна баннеров с последующей обклейкой ими кассы и подвесной конструкции -…,1 000 р.,1970-01-01,32,8,Для Бизнес-аккаунтов
"Верстка сайта по PSD-макету (С Гайдлайном), 6 страниц, Десктоп и Мобильная","Необходимо сверстать шаблон сайта на HTML + CSS, по PSD-макету.

Необходимо, чтобы сайт был адаптирован под все виды устройства, согласно Bootstrap-сетки.

В PS…",Договорная,1970-01-01,86,40,Для Бизнес-аккаунтов
Вакансия веб-разработчик на постоянной основе (частичная занятость),"Требуется веб-разработчик на частичную занятость: 3 часа в день, 5 дней в неделю.

В обязанности будет входить разработка и поддержание интернет проектов (каталог…",10 000 р.,1970-01-01,113,11,
